{
    "schemaVersion": 1,
    "templateId": "page:/pages/Home",
    "rootTemplateNodeId": 1,
    "nodes": [
        {
            "templateNodeId": 1,
            "host": {
                "type": "View",
                "props": {},
                "style": {
                    "width": {
                        "value": 300,
                        "unit": "logical-px"
                    },
                    "height": {
                        "value": 560,
                        "unit": "logical-px"
                    },
                    "paddingTop": {
                        "value": 12,
                        "unit": "logical-px"
                    },
                    "paddingRight": {
                        "value": 12,
                        "unit": "logical-px"
                    },
                    "paddingBottom": {
                        "value": 12,
                        "unit": "logical-px"
                    },
                    "paddingLeft": {
                        "value": 12,
                        "unit": "logical-px"
                    },
                    "flexDirection": "column",
                    "justifyContent": "center",
                    "alignItems": "center",
                    "backgroundColor": "#FFFFFF"
                }
            },
            "children": [
                {
                    "kind": "node",
                    "templateNodeId": 2
                },
                {
                    "kind": "node",
                    "templateNodeId": 3
                },
                {
                    "kind": "node",
                    "templateNodeId": 4
                },
                {
                    "kind": "block",
                    "templateBlockId": 1
                },
                {
                    "kind": "block",
                    "templateBlockId": 2
                },
                {
                    "kind": "node",
                    "templateNodeId": 8
                }
            ]
        },
        {
            "templateNodeId": 2,
            "host": {
                "type": "Text",
                "props": {
                    "text": ""
                },
                "style": {
                    "marginTop": {
                        "value": 4,
                        "unit": "logical-px"
                    },
                    "marginRight": {
                        "value": 4,
                        "unit": "logical-px"
                    },
                    "marginBottom": {
                        "value": 4,
                        "unit": "logical-px"
                    },
                    "marginLeft": {
                        "value": 4,
                        "unit": "logical-px"
                    },
                    "color": "#111111",
                    "fontSize": 24,
                    "textAlign": "center"
                }
            },
            "children": []
        },
        {
            "templateNodeId": 3,
            "host": {
                "type": "Text",
                "props": {
                    "text": ""
                },
                "style": {
                    "marginTop": {
                        "value": 4,
                        "unit": "logical-px"
                    },
                    "marginRight": {
                        "value": 4,
                        "unit": "logical-px"
                    },
                    "marginBottom": {
                        "value": 4,
                        "unit": "logical-px"
                    },
                    "marginLeft": {
                        "value": 4,
                        "unit": "logical-px"
                    },
                    "color": "#111111",
                    "fontSize": 24,
                    "textAlign": "center"
                }
            },
            "children": []
        },
        {
            "templateNodeId": 4,
            "host": {
                "type": "Button",
                "props": {
                    "text": "更新状态",
                    "enabled": true
                },
                "style": {
                    "width": {
                        "value": 220,
                        "unit": "logical-px"
                    },
                    "height": {
                        "value": 44,
                        "unit": "logical-px"
                    },
                    "marginTop": {
                        "value": 4,
                        "unit": "logical-px"
                    },
                    "marginRight": {
                        "value": 4,
                        "unit": "logical-px"
                    },
                    "marginBottom": {
                        "value": 4,
                        "unit": "logical-px"
                    },
                    "marginLeft": {
                        "value": 4,
                        "unit": "logical-px"
                    },
                    "backgroundColor": "#00C800",
                    "color": "#FFFFFF",
                    "borderRadius": 8
                }
            },
            "children": []
        },
        {
            "templateNodeId": 5,
            "host": {
                "type": "Text",
                "props": {
                    "text": "条件节点"
                },
                "style": {}
            },
            "children": []
        },
        {
            "templateNodeId": 6,
            "host": {
                "type": "View",
                "props": {},
                "style": {}
            },
            "children": [
                {
                    "kind": "node",
                    "templateNodeId": 7
                }
            ]
        },
        {
            "templateNodeId": 7,
            "host": {
                "type": "Text",
                "props": {
                    "text": ""
                },
                "style": {}
            },
            "children": []
        },
        {
            "templateNodeId": 8,
            "host": {
                "type": "Button",
                "props": {
                    "text": "打开详情",
                    "enabled": true
                },
                "style": {
                    "width": {
                        "value": 220,
                        "unit": "logical-px"
                    },
                    "height": {
                        "value": 44,
                        "unit": "logical-px"
                    },
                    "marginTop": {
                        "value": 4,
                        "unit": "logical-px"
                    },
                    "marginRight": {
                        "value": 4,
                        "unit": "logical-px"
                    },
                    "marginBottom": {
                        "value": 4,
                        "unit": "logical-px"
                    },
                    "marginLeft": {
                        "value": 4,
                        "unit": "logical-px"
                    },
                    "backgroundColor": "#00C800",
                    "color": "#FFFFFF",
                    "borderRadius": 8
                }
            },
            "children": []
        }
    ],
    "bindings": [
        {
            "templateBindingId": 1,
            "scope": {
                "kind": "page"
            },
            "target": {
                "templateNodeId": 2,
                "name": "text"
            }
        },
        {
            "templateBindingId": 2,
            "scope": {
                "kind": "page"
            },
            "target": {
                "templateNodeId": 3,
                "name": "text"
            }
        },
        {
            "templateBindingId": 3,
            "scope": {
                "kind": "block",
                "templateBlockId": 2
            },
            "target": {
                "templateNodeId": 7,
                "name": "text"
            }
        }
    ],
    "blocks": [
        {
            "templateBlockId": 1,
            "kind": "if",
            "parentTemplateNodeId": 1,
            "templateRootNodeId": 5
        },
        {
            "templateBlockId": 2,
            "kind": "for",
            "parentTemplateNodeId": 1,
            "templateRootNodeId": 6
        }
    ],
    "handlers": [
        {
            "templateHandlerId": 1,
            "scope": {
                "kind": "page"
            },
            "templateNodeId": 4,
            "eventType": "click"
        },
        {
            "templateHandlerId": 2,
            "scope": {
                "kind": "page"
            },
            "templateNodeId": 8,
            "eventType": "click"
        }
    ]
}